{
  "$schema": "https://json-schema.org/draft/2020-12/schema",
  "$id": "https://osworld.local/schemas/impress-artifact-blueprint.schema.json",
  "title": "Deterministic editable LibreOffice Impress artifact blueprint",
  "type": "object",
  "additionalProperties": false,
  "required": ["presentation_title", "slide_size", "theme", "slides", "manual_setup_steps"],
  "properties": {
    "presentation_title": {"type": "string", "minLength": 1},
    "slide_size": {"type": "string", "enum": ["wide", "standard"]},
    "theme": {
      "type": "object",
      "additionalProperties": false,
      "required": [
        "primary_color",
        "secondary_color",
        "accent_color",
        "background_color",
        "title_font",
        "body_font"
      ],
      "properties": {
        "primary_color": {"type": "string", "pattern": "^[0-9A-Fa-f]{6}$"},
        "secondary_color": {"type": "string", "pattern": "^[0-9A-Fa-f]{6}$"},
        "accent_color": {"type": "string", "pattern": "^[0-9A-Fa-f]{6}$"},
        "background_color": {"type": "string", "pattern": "^[0-9A-Fa-f]{6}$"},
        "title_font": {"type": "string", "minLength": 1},
        "body_font": {"type": "string", "minLength": 1}
      }
    },
    "slides": {
      "type": "array",
      "minItems": 2,
      "maxItems": 8,
      "items": {
        "type": "object",
        "additionalProperties": false,
        "required": ["slide_number", "purpose", "background_color", "objects"],
        "properties": {
          "slide_number": {"type": "integer", "minimum": 1, "maximum": 8},
          "purpose": {"type": "string", "minLength": 1},
          "background_color": {"type": "string", "pattern": "^[0-9A-Fa-f]{6}$"},
          "objects": {
            "type": "array",
            "minItems": 1,
            "maxItems": 16,
            "items": {
              "type": "object",
              "additionalProperties": false,
              "required": [
                "semantic_id",
                "type",
                "x",
                "y",
                "w",
                "h",
                "content",
                "style"
              ],
              "properties": {
                "semantic_id": {
                  "type": "string",
                  "pattern": "^[a-z][a-z0-9_]{0,47}$"
                },
                "type": {"type": "string", "enum": ["text", "shape", "image", "table", "chart"]},
                "x": {"type": "number", "minimum": 0, "maximum": 13.333},
                "y": {"type": "number", "minimum": 0, "maximum": 7.5},
                "w": {"type": "number", "exclusiveMinimum": 0, "maximum": 13.333},
                "h": {"type": "number", "exclusiveMinimum": 0, "maximum": 7.5},
                "content": {
                  "type": "object",
                  "additionalProperties": false,
                  "required": [
                    "text",
                    "shape_kind",
                    "image_kind",
                    "rows",
                    "categories",
                    "series"
                  ],
                  "properties": {
                    "text": {"type": ["string", "null"]},
                    "shape_kind": {
                      "type": ["string", "null"],
                      "enum": [null, "rect", "round_rect", "ellipse", "chevron", "line"]
                    },
                    "image_kind": {
                      "type": ["string", "null"],
                      "enum": [
                        null,
                        "landscape",
                        "person",
                        "product",
                        "document",
                        "botanical",
                        "pollinator",
                        "garden",
                        "map"
                      ]
                    },
                    "rows": {
                      "type": "array",
                      "maxItems": 8,
                      "items": {
                        "type": "array",
                        "minItems": 1,
                        "maxItems": 6,
                        "items": {"type": "string"}
                      }
                    },
                    "categories": {
                      "type": "array",
                      "maxItems": 8,
                      "items": {"type": "string"}
                    },
                    "series": {
                      "type": "array",
                      "maxItems": 4,
                      "items": {
                        "type": "object",
                        "additionalProperties": false,
                        "required": ["name", "values"],
                        "properties": {
                          "name": {"type": "string"},
                          "values": {
                            "type": "array",
                            "maxItems": 8,
                            "items": {"type": "number"}
                          }
                        }
                      }
                    }
                  }
                },
                "style": {
                  "type": "object",
                  "additionalProperties": false,
                  "required": [
                    "fill_color",
                    "line_color",
                    "text_color",
                    "font_face",
                    "font_size",
                    "bold",
                    "italic",
                    "underline",
                    "align",
                    "valign"
                  ],
                  "properties": {
                    "fill_color": {"type": "string", "pattern": "^[0-9A-Fa-f]{6}$"},
                    "line_color": {"type": "string", "pattern": "^[0-9A-Fa-f]{6}$"},
                    "text_color": {"type": "string", "pattern": "^[0-9A-Fa-f]{6}$"},
                    "font_face": {"type": "string", "minLength": 1},
                    "font_size": {"type": "number", "minimum": 8, "maximum": 72},
                    "bold": {"type": "boolean"},
                    "italic": {"type": "boolean"},
                    "underline": {"type": "boolean"},
                    "align": {"type": "string", "enum": ["left", "center", "right"]},
                    "valign": {"type": "string", "enum": ["top", "mid", "bottom"]}
                  }
                }
              }
            }
          }
        }
      }
    },
    "manual_setup_steps": {
      "type": "array",
      "items": {"type": "string", "minLength": 1}
    }
  }
}
