{
  "presentation_title": "Dawn Marsh Survey",
  "slide_size": "wide",
  "theme": {
    "primary_color": "0B3D4A",
    "secondary_color": "D8E5DD",
    "accent_color": "F4C542",
    "background_color": "F7F4EC",
    "title_font": "Liberation Sans",
    "body_font": "Liberation Sans"
  },
  "slides": [
    {
      "slide_number": 1,
      "purpose": "Briefing cover that establishes the survey identity and provides context for the checklist slide.",
      "background_color": "F7F4EC",
      "objects": [
        {
          "semantic_id": "cover_title",
          "type": "text",
          "x": 0.8,
          "y": 1.15,
          "w": 7.7,
          "h": 0.72,
          "content": {
            "text": "Dawn Marsh Survey",
            "shape_kind": null,
            "image_kind": null,
            "rows": [],
            "categories": [],
            "series": []
          },
          "style": {
            "fill_color": "F7F4EC",
            "line_color": "F7F4EC",
            "text_color": "0B3D4A",
            "font_face": "Liberation Sans",
            "font_size": 30,
            "bold": true,
            "italic": false,
            "underline": false,
            "align": "left",
            "valign": "mid"
          }
        },
        {
          "semantic_id": "cover_subtitle",
          "type": "text",
          "x": 0.84,
          "y": 2.02,
          "w": 6.9,
          "h": 0.54,
          "content": {
            "text": "Early field briefing · 14 May · Estuary team",
            "shape_kind": null,
            "image_kind": null,
            "rows": [],
            "categories": [],
            "series": []
          },
          "style": {
            "fill_color": "F7F4EC",
            "line_color": "F7F4EC",
            "text_color": "0B3D4A",
            "font_face": "Liberation Sans",
            "font_size": 16,
            "bold": false,
            "italic": false,
            "underline": false,
            "align": "left",
            "valign": "mid"
          }
        },
        {
          "semantic_id": "cover_horizon_band",
          "type": "shape",
          "x": 0,
          "y": 5.7,
          "w": 13.333,
          "h": 1.8,
          "content": {
            "text": null,
            "shape_kind": "rect",
            "image_kind": null,
            "rows": [],
            "categories": [],
            "series": []
          },
          "style": {
            "fill_color": "0B3D4A",
            "line_color": "0B3D4A",
            "text_color": "0B3D4A",
            "font_face": "Liberation Sans",
            "font_size": 12,
            "bold": false,
            "italic": false,
            "underline": false,
            "align": "left",
            "valign": "mid"
          }
        },
        {
          "semantic_id": "cover_location_badge",
          "type": "shape",
          "x": 0.82,
          "y": 3.15,
          "w": 2.45,
          "h": 0.52,
          "content": {
            "text": null,
            "shape_kind": "round_rect",
            "image_kind": null,
            "rows": [],
            "categories": [],
            "series": []
          },
          "style": {
            "fill_color": "D8E5DD",
            "line_color": "0B3D4A",
            "text_color": "0B3D4A",
            "font_face": "Liberation Sans",
            "font_size": 12,
            "bold": false,
            "italic": false,
            "underline": false,
            "align": "center",
            "valign": "mid"
          }
        },
        {
          "semantic_id": "cover_location_label",
          "type": "text",
          "x": 0.92,
          "y": 3.24,
          "w": 2.25,
          "h": 0.28,
          "content": {
            "text": "NORTH BASIN MARSH",
            "shape_kind": null,
            "image_kind": null,
            "rows": [],
            "categories": [],
            "series": []
          },
          "style": {
            "fill_color": "D8E5DD",
            "line_color": "D8E5DD",
            "text_color": "0B3D4A",
            "font_face": "Liberation Sans",
            "font_size": 10,
            "bold": true,
            "italic": false,
            "underline": false,
            "align": "center",
            "valign": "mid"
          }
        }
      ]
    },
    {
      "slide_number": 2,
      "purpose": "Field-team setup checklist to be finalized before departure.",
      "background_color": "F7F4EC",
      "objects": [
        {
          "semantic_id": "checklist_heading_band",
          "type": "shape",
          "x": 0.62,
          "y": 0.42,
          "w": 7.42,
          "h": 0.92,
          "content": {
            "text": null,
            "shape_kind": "round_rect",
            "image_kind": null,
            "rows": [],
            "categories": [],
            "series": []
          },
          "style": {
            "fill_color": "D8E5DD",
            "line_color": "D8E5DD",
            "text_color": "0B3D4A",
            "font_face": "Liberation Sans",
            "font_size": 12,
            "bold": false,
            "italic": false,
            "underline": false,
            "align": "left",
            "valign": "top"
          }
        },
        {
          "semantic_id": "checklist_slide_heading",
          "type": "text",
          "x": 0.8,
          "y": 0.62,
          "w": 6.9,
          "h": 0.54,
          "content": {
            "text": "Departure readiness",
            "shape_kind": null,
            "image_kind": null,
            "rows": [],
            "categories": [],
            "series": []
          },
          "style": {
            "fill_color": "F7F4EC",
            "line_color": "F7F4EC",
            "text_color": "0B3D4A",
            "font_face": "Liberation Sans",
            "font_size": 25,
            "bold": true,
            "italic": false,
            "underline": false,
            "align": "left",
            "valign": "mid"
          }
        },
        {
          "semantic_id": "checklist_intro_panel",
          "type": "shape",
          "x": 0.8,
          "y": 1.35,
          "w": 7.05,
          "h": 0.4,
          "content": {
            "text": null,
            "shape_kind": "round_rect",
            "image_kind": null,
            "rows": [],
            "categories": [],
            "series": []
          },
          "style": {
            "fill_color": "D8E5DD",
            "line_color": "D8E5DD",
            "text_color": "0B3D4A",
            "font_face": "Liberation Sans",
            "font_size": 12,
            "bold": false,
            "italic": false,
            "underline": false,
            "align": "left",
            "valign": "top"
          }
        },
        {
          "semantic_id": "checklist_intro_label",
          "type": "text",
          "x": 1.06,
          "y": 1.42,
          "w": 5.5,
          "h": 0.31,
          "content": {
            "text": "Verify before leaving the staging point",
            "shape_kind": null,
            "image_kind": null,
            "rows": [],
            "categories": [],
            "series": []
          },
          "style": {
            "fill_color": "D8E5DD",
            "line_color": "D8E5DD",
            "text_color": "0B3D4A",
            "font_face": "Liberation Sans",
            "font_size": 12,
            "bold": true,
            "italic": false,
            "underline": false,
            "align": "left",
            "valign": "mid"
          }
        },
        {
          "semantic_id": "readiness_list_panel",
          "type": "shape",
          "x": 0.8,
          "y": 1.78,
          "w": 7.05,
          "h": 2.66,
          "content": {
            "text": null,
            "shape_kind": "round_rect",
            "image_kind": null,
            "rows": [],
            "categories": [],
            "series": []
          },
          "style": {
            "fill_color": "D8E5DD",
            "line_color": "0B3D4A",
            "text_color": "0B3D4A",
            "font_face": "Liberation Sans",
            "font_size": 12,
            "bold": false,
            "italic": false,
            "underline": false,
            "align": "left",
            "valign": "mid"
          }
        },
        {
          "semantic_id": "readiness_list_text",
          "type": "text",
          "x": 1.1,
          "y": 2.13,
          "w": 5.9,
          "h": 1.7,
          "content": {
            "text": "Calibrate water meter\nPack sample envelopes\nConfirm trail access",
            "shape_kind": null,
            "image_kind": null,
            "rows": [],
            "categories": [],
            "series": []
          },
          "style": {
            "fill_color": "D8E5DD",
            "line_color": "D8E5DD",
            "text_color": "0B3D4A",
            "font_face": "Liberation Sans",
            "font_size": 18,
            "bold": false,
            "italic": false,
            "underline": false,
            "align": "left",
            "valign": "top"
          }
        },
        {
          "semantic_id": "launch_time_status",
          "type": "text",
          "x": 0.84,
          "y": 4.76,
          "w": 3.85,
          "h": 0.45,
          "content": {
            "text": "Launch window: 08:30",
            "shape_kind": null,
            "image_kind": null,
            "rows": [],
            "categories": [],
            "series": []
          },
          "style": {
            "fill_color": "F7F4EC",
            "line_color": "F7F4EC",
            "text_color": "0B3D4A",
            "font_face": "Liberation Sans",
            "font_size": 17,
            "bold": true,
            "italic": false,
            "underline": false,
            "align": "left",
            "valign": "mid"
          }
        },
        {
          "semantic_id": "battery_reminder_panel",
          "type": "shape",
          "x": 0.74,
          "y": 5.28,
          "w": 3.92,